link,title,source,comments,datetime
https://www.toutiao.com/group/6795726946182365708/,紧急！“日本冠状疫情突发失控”背后原因在中国无法想象,大河看法,4686,2020-02-21 10:51:19
https://www.toutiao.com/group/6795726946182365708/,紧急！“日本冠状疫情突发失控”背后原因在中国无法想象,大河看法,4686,2020-02-21 10:51:19
,日本-百科,,,
https://www.toutiao.com/group/6795409069420053006/,果然轮到中国回馈日本，中国网友：投桃报李，日本网友：感谢中国,环球网,2872,2020-02-20 14:17:47
https://www.toutiao.com/group/6796502118086738440/,日本网友抱怨政府应对新冠肺炎太过随意：希望当年能出生在大马,英国英鸟,0,2020-02-23 12:59:22
https://www.toutiao.com/group/6796485648862675469/,累计确诊739例，日本将恢复从中国进口口罩！外交部重磅回应,半岛晨报,0,2020-02-23 11:55:28
https://www.toutiao.com/group/6796497329240146444/,最新！日本新冠肺炎确诊病例升至769例！,BTV新闻,0,2020-02-23 12:40:47
https://www.toutiao.com/group/6796478938735444488/,日本新冠肺炎累计确诊769例 政府加紧制定应对方针,环球网,3,2020-02-23 11:29:25
https://www.toutiao.com/group/6795845147125875207/,日本感染者数直线上升，国人坐不住了……,TOP旅行杂志,2159,2020-02-21 18:30:00
https://www.toutiao.com/group/6796438236357984772/,测出阳性会耽误上班！日本政府90多名登船职员未接受病毒检测,青蜂侠,562,2020-02-23 08:51:29
https://www.toutiao.com/group/6796462017906475533/,日本疫情仍然可控：不会出现封城现象，不会影响东京奥运会,国平军史,9,2020-02-23 10:23:46
https://www.toutiao.com/group/6796458258480497166/,日本情况严重 东京不会封城 两个原因与武汉不同,木春山谈天下,3,2020-02-23 10:09:10
https://www.toutiao.com/group/6795478798868414984/,肺炎！今天，日本人最担心的一幕出现了,万象新闻,2,2020-02-20 18:48:22
https://www.toutiao.com/group/6795683701477868040/,日本累计确诊728例新冠肺炎 专家：此前“重视程度”确实不够,光明网,74,2020-02-21 08:03:30
https://www.toutiao.com/group/6796475289988760072/,【#日本新确诊26例新冠肺炎# #日本累计确诊769例#】,长安号,1,2020-02-23 11:15:16
https://www.toutiao.com/group/6795072187817525763/,日本新冠肺炎确诊519例，预计10天后新增感染12万人,IT之家,464,2020-02-19 16:30:31
https://www.toutiao.com/group/6795476072113635853/,日媒：日本新冠肺炎确诊人数已达712人,中国新闻网,834,2020-02-20 18:37:47
https://www.toutiao.com/group/6795708229994152452/,日本疫情告急，大臣在镜头前不断咳嗽，连安倍也被警卫带走,北方晨报最热门,6544,2020-02-21 09:38:41
https://www.toutiao.com/group/6796508982618882563/,日本抗击新冠病毒为何没有抄中国作业？,徐静波,3,2020-02-23 13:26:01
https://www.toutiao.com/group/6796471299368550919/,日本女教师感染新冠病毒被诊断感冒 正常上课监考 疫情或校园蔓延,看看新闻,312,2020-02-23 10:59:47
https://www.toutiao.com/group/6796450978234106375/,日本新确诊26例新冠肺炎 累计确诊769例,e公司,0,2020-02-23 09:40:55
https://www.toutiao.com/group/6796462017906475533/,日本疫情仍然可控：不会出现封城现象，不会影响东京奥运会,国平军史,9,2020-02-23 10:23:46
https://www.toutiao.com/group/6795336897867547150/,日本疫情“画风生变”，民众反应究竟如何？,光明网,3,2020-02-20 09:37:43
https://www.toutiao.com/group/6794772674687009291/,日本新冠肺炎人数节节攀升，为什么他们不在意？其实是有苦说不出,普外科曾医生,14,2020-02-18 21:08:15
https://www.toutiao.com/group/6795338062885814787/,日本大学教授赌上前途，发视频公开游轮内部惨状，浏览百万后删除,闻舞视界,3,2020-02-20 09:42:15
https://www.toutiao.com/group/6795004613146706440/,日本会不会成为下一个中国？东京地铁发现确诊患者，多家公司允许员工在家上班，奥运会能否如期举办面临考问,观象台,2398,2020-02-19 12:08:17
https://www.toutiao.com/group/6796480118601548300/,下船后才发现！日本这一连串漏洞也太可怕了,万象新闻,2,2020-02-23 11:34:00
https://www.toutiao.com/group/6796475289988760072/,【#日本新确诊26例新冠肺炎# #日本累计确诊769例#】,长安号,1,2020-02-23 11:15:16
https://www.toutiao.com/group/6796487305591783943/,日本再次表示，耗资250亿美元的东京奥运会“会切实进行准备”,体坛报,0,2020-02-23 12:01:54
https://www.toutiao.com/group/6796468177338368516/,二战中日本最好的航空母舰：战绩最佳战力最持久,ALEX俊赫君,0,2020-02-23 13:00:00
https://www.toutiao.com/group/6796458099038224910/,日本政府正探讨拒绝承担驻日美军巨额经费,人民网,4,2020-02-23 10:08:33
https://www.toutiao.com/group/6796480450601681422/,日本探讨使用抗流感药物治疗新冠肺炎,新华社,3,2020-02-23 11:35:17
https://www.toutiao.com/group/6796475978580230667/,27岁日本全职妈妈的一天：每天五点半起床做便当，比上班还累,美术史知识大全,0,2020-02-23 13:11:00
https://www.toutiao.com/group/6794718460380185096/,日本进入高爆发期？一夜感染者突破400人，日媒预计将有10万人感染！感染者曾带病上班，开出租，到处乱跑..,万象新闻,7613,2020-02-18 17:37:52
https://www.toutiao.com/group/6794861181640114696/,日本承认病毒扩散，感染者可能暴增到12万！最可怕的疫情就要发生了,韦三水,1021,2020-02-19 02:51:42
https://www.toutiao.com/group/6796492311833346574/,日本不检测上船医务人员，竟是因“一旦确诊将影响工作”？,齐鲁壹点,0,2020-02-23 12:21:19
https://www.toutiao.com/group/6796475978580230667/,27岁日本全职妈妈的一天：每天五点半起床做便当，比上班还累,美术史知识大全,0,2020-02-23 13:11:00
,日本新增26例新冠肺炎病例，累计确诊达到769例|懂球帝,,,
https://www.toutiao.com/group/6796492311833346574/,日本不检测上船医务人员，竟是因“一旦确诊将影响工作”？,齐鲁壹点,0,2020-02-23 12:21:19
https://www.toutiao.com/group/6794861181640114696/,日本承认病毒扩散，感染者可能暴增到12万！最可怕的疫情就要发生了,韦三水,1021,2020-02-19 02:51:42
https://www.toutiao.com/group/6796500713099756039/,日本人分享一些没见过的中国美景，这个城市夜景太美，都被惊艳啦,FOX体育资讯,1,2020-02-23 12:53:55
https://www.toutiao.com/group/6796434664958460424/,日本千叶市一名初中女教师确诊新冠肺炎，学校紧急停课,光明网,1,2020-02-23 08:37:37
https://www.toutiao.com/group/6796498522255393293/,日本预计今年至少取消206次邮轮靠港，损失或达数十亿日元,环球网,3,2020-02-23 12:45:25
https://www.toutiao.com/group/6793927315232391694/,一日增加近10倍确诊病例，日本会封城吗？感染路径扑朔迷离,匀枫财技大兜底,4319,2020-02-16 14:27:49
https://www.toutiao.com/group/6795426417556324868/,感染病例迅速增加？日本新型冠状病毒疫情会比我们更严重吗？,静夜史,20,2020-02-20 15:25:06
https://www.toutiao.com/group/6795307132494283272/,日本新型冠状病毒感染达704例,光明网,16,2020-02-20 07:42:13
https://www.toutiao.com/group/6796517295712633351/,日本出现首例“钻石公主号”下船后确诊病例，搭乘公共交通回家,环球网,0,2020-02-23 13:58:16
https://www.toutiao.com/group/6796495425311343112/,日本首现下船后被确诊病例，安倍政府之前的保证遭“打脸”,齐鲁壹点,2,2020-02-23 12:33:24
https://www.toutiao.com/group/6796480486173573644/,苍井空喜得双胞胎的背后，反映日本女性这些生活习惯，远离妇科病,孕育岛,0,2020-02-23 11:35:26
https://www.toutiao.com/group/6789859767994024461/,日本航空往返中国的部分航班停航，部分路线减少航班,澎湃新闻,17,2020-02-05 15:23:40
https://www.toutiao.com/group/6796458363254211079/,日本超六万球迷涌入球场，J联赛因口罩上热搜,周到客户端,0,2020-02-23 10:09:35
https://www.toutiao.com/group/6795319393157906958/,日本新冠肺炎确诊病例达705人 应对举措存不足？,台海网,11,2020-02-20 08:29:48
https://www.toutiao.com/group/6796449156274586124/,日本男篮公布亚预赛12人名单，八村塁无缘，1.67米后卫入围,青葱往事,0,2020-02-23 09:33:51
https://www.toutiao.com/group/6796483626734191115/,英国老夫妻被感染，称日本医院糟糕如监狱，儿子无奈找特朗普求救,英国英鸟,0,2020-02-23 11:47:37
https://www.toutiao.com/group/6796505657005572615/,抗日神剧里为什么没有“鸠山”这一日本姓氏？原因其实很简单,方圆文史,0,2020-02-23 13:13:06
https://www.toutiao.com/group/6796201270043476483/,再次确诊88人！日本豪华游轮疫情再次扩大，日本能抗过去吗？,小芋圆在日本,37,2020-02-22 17:31:56
https://www.toutiao.com/group/6796515768751096328/,90年前日本为何会流行脑炎？答案跟日本的墓葬形式有关,启蒙时代的余孽,0,2020-02-23 13:52:21
https://www.toutiao.com/group/6796491966738596355/,初识日本：日本省份划分,话说房地产,0,2020-02-23 12:19:59
https://www.toutiao.com/group/6796449156274586124/,日本男篮公布亚预赛12人名单，八村塁无缘，1.67米后卫入围,青葱往事,0,2020-02-23 09:33:51
https://www.toutiao.com/group/6796507240825094667/,日本北海道一天内确诊9名新冠肺炎患者 感染路径不明,深圳卫视正午30分,0,2020-02-23 13:19:15
https://www.toutiao.com/group/6795384815928476172/,首例感染死亡初现，疫情开始在日本蔓延，现在全球担心的是日本,长江号外,15,2020-02-20 12:43:40
https://www.toutiao.com/group/6796216930584756749/,日本篮球全面超越中国？再不努力 五年内就成为现实了,新兴体育,46,2020-02-22 18:32:42
https://www.toutiao.com/group/6796204058148340238/,游客减少产业不振，新冠疫情下日本经济面临放缓风险,亚太日报财经,2,2020-02-22 17:42:45
https://www.toutiao.com/group/6796459414183215624/,日本人究竟发明了几种咖喱料理？说不定你吃过其中的好几种,漫谈上下五千年,0,2020-02-23 10:13:39
https://www.toutiao.com/group/6796490101951037960/,日本首例下船后确认感染病例！中国网友焦急喊话,科技日报,0,2020-02-23 12:12:45
https://www.toutiao.com/group/6796507002882228739/,日本种公马“龙王”之子“众神之首”斩获澳洲700万奖金蓝钻锦标,大陆赛马网,0,2020-02-23 13:18:20
https://www.toutiao.com/group/6795319393157906958/,日本新冠肺炎确诊病例达705人 应对举措存不足？,台海网,11,2020-02-20 08:29:48
https://www.toutiao.com/group/6796453490446041614/,日本新冠肺炎累计确诊769例！韩国556例,津云,0,2020-02-23 09:50:40
https://www.toutiao.com/group/6796494292153008654/,专访：中方愿与日方加强合作携手抗疫——访中国驻日本大使孔铉佑,人民网,1,2020-02-23 12:29:00
https://www.toutiao.com/group/6796222906469712388/,爆大冷！日本世界冠军惜败出局，平野美宇3-4韩莹无缘战伊藤美诚,体育哒哒君,0,2020-02-22 18:55:54
https://www.toutiao.com/group/6796438907115274764/,日本把大连当做是自己的一个州，建造了一座独特的别院寺庙,贱行旅志,4,2020-02-23 08:54:05
https://www.toutiao.com/group/6796485324206768643/,日本疫情爆发，东京奥运会能否如期举行？东京奥组委表态,天视体育频道,0,2020-02-23 11:54:12
https://www.toutiao.com/group/6796490216157741580/,日本工薪玩车族，一人养三辆铃木,爱拆车,3,2020-02-23 12:13:11
https://www.toutiao.com/group/6796505657005572615/,抗日神剧里为什么没有“鸠山”这一日本姓氏？原因其实很简单,方圆文史,0,2020-02-23 13:13:06
https://www.toutiao.com/group/6796483626734191115/,英国老夫妻被感染，称日本医院糟糕如监狱，儿子无奈找特朗普求救,英国英鸟,0,2020-02-23 11:47:37
https://www.toutiao.com/group/6796215553502478852/,刘国梁匿名捐款68.8万！仍被媒体“抓到”，日本或难成国乒集训地,沃德乒乓球体育爱好者,1,2020-02-22 18:27:21
https://www.toutiao.com/group/6796485274407797260/,“维新三杰”之一的木户孝允，为何被人称为“日本的张良”,老刘说历史,0,2020-02-23 12:07:52
https://www.toutiao.com/group/6796204058148340238/,游客减少产业不振，新冠疫情下日本经济面临放缓风险,亚太日报财经,2,2020-02-22 17:42:45
https://www.toutiao.com/group/6796438907115274764/,日本把大连当做是自己的一个州，建造了一座独特的别院寺庙,贱行旅志,4,2020-02-23 08:54:05
https://www.toutiao.com/group/6796481562494894605/,日本小姐姐自制“蕾丝口罩”火了！外形甜美似内衣，敢戴出门吗？,隔夜说动漫,0,2020-02-23 11:39:37
https://www.toutiao.com/group/6796515848434483719/,央视决赛全程直播！杨影缺席球迷怀念，日本有望包揽男女单冠亚军,土土女排,0,2020-02-23 13:52:39
https://www.toutiao.com/group/6796459414183215624/,日本人究竟发明了几种咖喱料理？说不定你吃过其中的好几种,漫谈上下五千年,0,2020-02-23 10:13:39
https://www.toutiao.com/group/6796201644070535683/,世界卫生组织急了！日本或成为第二个武汉,北京天海京视传媒,0,2020-02-22 17:33:23
https://www.toutiao.com/group/6796491966738596355/,初识日本：日本省份划分,话说房地产,0,2020-02-23 12:19:59
https://www.toutiao.com/group/6796457698255700491/,日本历史上第一个签订无条件投降书的将军：岗村宁次,后宫地图三千,0,2020-02-23 10:07:00
https://www.toutiao.com/group/6796222906469712388/,爆大冷！日本世界冠军惜败出局，平野美宇3-4韩莹无缘战伊藤美诚,体育哒哒君,0,2020-02-22 18:55:54
https://www.toutiao.com/group/6796485324206768643/,日本疫情爆发，东京奥运会能否如期举行？东京奥组委表态,天视体育频道,0,2020-02-23 11:54:12
https://www.toutiao.com/group/6796484324045619719/,日本担忧疫情校园蔓延,新华社,1,2020-02-23 11:50:19
https://www.toutiao.com/group/6796486391262872076/,笑话：一哥们要去日本留学，他听说日本治安很好，都不需要锁门,醉饮啸惊鸿,0,2020-02-23 11:58:21
https://www.toutiao.com/group/6796500998408897036/,大阪名胜大阪城中心天守阁，登城了解日本历史文化，欣赏日本景色,乐活志,0,2020-02-23 12:55:02
https://www.toutiao.com/group/6796491991975723527/,乒乓球匈牙利公开赛日本单打冲冠，国乒海外备战下一站去哪儿？,上游新闻,0,2020-02-23 12:20:05
https://www.toutiao.com/group/6796460586583458315/,日本为什么会提出“大东亚共荣圈”？,后宫地图三千,0,2020-02-23 10:18:13
https://www.toutiao.com/group/6796215553502478852/,刘国梁匿名捐款68.8万！仍被媒体“抓到”，日本或难成国乒集训地,沃德乒乓球体育爱好者,1,2020-02-22 18:27:21
https://www.toutiao.com/group/6796446297772524044/,日本的女人，为什么名字中很多喜欢带个“子”？,瓜栗123,1,2020-02-23 09:22:46
https://www.toutiao.com/group/6784586451536314887/,中国驻日本大使馆发布春节赴日本旅游温馨提示,中国经济网,33,2020-01-22 10:20:30
https://www.toutiao.com/group/6762702365305864717/,不经意间暴露真正实力，日本大批黑科技亮相东京，此前一直被欺骗,诸葛小彻,59,2019-11-24 11:06:53
https://www.toutiao.com/group/6796215553502478852/,刘国梁匿名捐款68.8万！仍被媒体“抓到”，日本或难成国乒集训地,沃德乒乓球体育爱好者,1,2020-02-22 18:27:21
https://www.toutiao.com/group/6784586451536314887/,中国驻日本大使馆发布春节赴日本旅游温馨提示,中国经济网,33,2020-01-22 10:20:30
https://www.toutiao.com/group/6762702365305864717/,不经意间暴露真正实力，日本大批黑科技亮相东京，此前一直被欺骗,诸葛小彻,59,2019-11-24 11:06:53
https://www.toutiao.com/group/6796449577244295695/,日本不检测下船的检疫和医护人员,中国网直播,0,2020-02-23 09:35:29
https://www.toutiao.com/group/6795785534577836551/,浅谈日本航空母舰（五）——歪歪斜斜的“双鹰”,1个西瓜的橙子,2,2020-02-23 11:18:07
https://www.toutiao.com/group/6796512322639626764/,老照片：最后投降的日本鬼子，竟然在菲律宾丛林苟活了几十年,老猪的碎碎念,0,2020-02-23 13:38:58
https://www.toutiao.com/group/6795089683844956683/,日本终于公开了……,汕头政法,444,2020-02-19 20:37:00
https://www.toutiao.com/group/6796209367927489028/,前鲁能中场铁腰成日本球队大佬 J联赛首轮破门帮助仙台延续记录,朋克足球,57,2020-02-22 18:03:21
https://www.toutiao.com/group/6796444477733995016/,在日本，为啥女学生都喜欢穿短裙？冬天也是“光腿”,瓜栗123,0,2020-02-23 09:15:42
https://www.toutiao.com/group/6796312806799966723/,日本水果贵到逆天？带你走进日本生活区真实蔬果物价！水果吃到饱,烦恼的猴子哥,0,2020-02-23 10:33:00
https://www.toutiao.com/group/6796184511873810947/,日本是世界强国吗？日本经济总量达到5万亿美元,理性的爱国者,13,2020-02-22 19:00:00
https://www.toutiao.com/group/6796222810348847628/,平野美宇3-4惨遭爆冷出局！华裔老将险胜日本世界冠军 怒吼进4强,足坛宙斯,0,2020-02-22 18:55:31
https://www.toutiao.com/group/6796504214609592835/,克星来了！36岁华裔连续淘汰日本2大主力，里约绝杀福原爱摘银,土土女排,0,2020-02-23 13:07:31
https://www.toutiao.com/group/6796455526629638663/,去日本旅游一定要注意这10件事情！,信宜阿权,0,2020-02-23 09:58:34
https://www.toutiao.com/group/6674046382325629452/,这些日本网友，叕在瞎说什么大实话,日本通,80,2019-03-30 13:08:35
https://www.toutiao.com/group/6748430620902294020/,时隔8年，日本请别带着全人类一起灭亡,冲浪普拉斯,5373,2019-10-16 23:57:25
https://www.toutiao.com/group/6796442690910159371/,日本的国歌仅有28个字，翻译成中文后，才明白日本人的野心有多大,泺泺影视,0,2020-02-23 09:08:46
https://www.toutiao.com/group/6796488917332787723/,死法最惨烈的日本人：近距离遭受核辐射后，医生强行让其存活83天,加拿大乐活网,0,2020-02-23 12:08:09
https://www.toutiao.com/group/6793224193094713864/,日本的孩子有多“早熟”？看完这些照片，网友：刷底线、毁三观,李莉育儿日记,30,2020-02-14 20:56:00
https://www.toutiao.com/group/6796204637872456203/,日本球员大爆发，一人帽子戏法后，一天才独造3球，武磊保级更难,熙攘体育,0,2020-02-22 17:45:00
https://www.toutiao.com/group/6789539703277224455/,关于日本的15个冷知识，你都知道几个呢？,今川日语,0,2020-02-04 20:01:00
https://www.toutiao.com/group/6674081611086037512/,日本人取外号的本事，真是4000年一遇,新周刊,1332,2019-03-30 15:25:17
https://www.toutiao.com/group/6780570098085134856/,日本人均收入远超中国，为何却不爱买豪车？,汽修KING百家文化,47,2020-01-11 14:35:00
https://www.toutiao.com/group/6773960288082330115/,日本有多强？,四国日语,77,2019-12-24 19:13:22
https://www.toutiao.com/group/6716126257454531084/,日本突然宣布引进五种病毒，俄媒：一场新的战争已经悄然酝酿,深度军备,1956,2019-07-22 12:40:08
https://www.toutiao.com/group/6794774919407206924/,来过日本就知道，这8个关于日本的事实，你知道几个呢？,搜罗旅行叹世界,0,2020-02-18 21:16:58
https://www.toutiao.com/group/6796474306860679694/,日本零食大赏榜单｜日本人心里超好吃的零食原来是这些啊,福建自驾e族,0,2020-02-23 11:19:40
https://www.toutiao.com/group/6792120638963188235/,暖心举动！日本重要部门向内部号召：每人向中国捐款5000日元,金十数据,1181,2020-02-11 17:37:00
https://www.toutiao.com/group/6796508472314692100/,日本疫情形势严峻，扎堆日本游的明星慌了，要不再去别处转转？,新角度新视角,0,2020-02-23 13:24:02
https://www.toutiao.com/group/6706406128399417867/,（番外篇）定居日本都可以享受哪些福利制度？,司马看日本,183,2019-06-27 11:30:48
https://www.toutiao.com/group/6745029575903805955/,日本网友吐槽：桥本环奈已经毁了，下一个吧,萌娘ACG研究所,244,2019-10-07 20:11:49
https://www.toutiao.com/group/6749727532825707020/,日本宣布向中东出兵，大批精锐部队即将启程，美：非常失望,虚实九变,21,2019-10-20 22:14:40
https://www.toutiao.com/group/6796446297772524044/,日本的女人，为什么名字中很多喜欢带个“子”？,瓜栗123,1,2020-02-23 09:22:46
https://www.toutiao.com/group/6713875106868757003/,日本两位35岁+小姐姐分享日常穿搭！简约舒适又减龄，太太太好看啦,新鲜日本,88,2019-07-15 21:04:22
https://www.toutiao.com/group/6796224240191275534/,1胜5负 平野美宇2度领先仍被逆转 国乒缺阵日本主力仍无缘4强,狂言体育,0,2020-02-22 19:01:04
https://www.toutiao.com/group/6736897869397099019/,日本是如何变成一个低欲望社会的？,金融视野,10,2019-09-15 22:04:27
https://www.toutiao.com/group/6675917384672346635/,20年前日本GDP是中国的7倍，如今不到中国的一半，发生了什么？,希财网,1193,2019-04-05 20:36:00
https://www.toutiao.com/group/6796217128505573896/,日本旅游-浅草寺-雷门等部分景点图,冬瓜滕下,0,2020-02-22 18:33:28
https://www.toutiao.com/group/6796486391262872076/,笑话：一哥们要去日本留学，他听说日本治安很好，都不需要锁门,醉饮啸惊鸿,0,2020-02-23 11:58:21
https://www.toutiao.com/group/6794774919407206924/,来过日本就知道，这8个关于日本的事实，你知道几个呢？,搜罗旅行叹世界,0,2020-02-18 21:16:58
https://www.toutiao.com/group/6795550496489734670/,日本累计确诊新冠肺炎728例，死亡3例,人民日报,579,2020-02-20 23:26:36
https://www.toutiao.com/group/6796490053297111559/,日本出现首例“钻石公主号”下船后确诊病例，还有23人未经检测就下船,每日经济新闻,0,2020-02-23 12:12:33
https://www.toutiao.com/group/6796451411069501959/,日本首例！“下船”后确诊，中国网友焦急喊话,光明网,0,2020-02-23 09:42:36
https://www.toutiao.com/group/6796450026152264205/,日本新增确诊病例26例，累计确诊769例,环球网,1,2020-02-23 09:37:14
https://www.toutiao.com/group/6796487034430030344/,日本出现首例下船后确诊病例,观察者网新媒体,1,2020-02-23 12:00:50
https://www.toutiao.com/group/6796459961242092045/,日本22日累计确诊新冠肺炎病例达769例,央视新闻,12,2020-02-23 10:15:47
https://www.toutiao.com/group/6796478263205036558/,日本这一连串漏洞也太可怕了,中国经济网,6,2020-02-23 11:26:48
https://www.toutiao.com/group/6796463780508205581/,日本新增26例新冠肺炎确诊病例，累计确诊病例升至769例,北京商报,0,2020-02-23 10:30:36
https://www.toutiao.com/group/6796480770929066503/,日本这一连串漏洞也太可怕了,中国青年网,1,2020-02-23 11:36:32
https://www.toutiao.com/group/6796490504365146637/,日本要摆脱美国殖民，将拒绝为驻日美军提供经费？,祖国瞭望,0,2020-02-23 12:14:18
https://www.toutiao.com/group/6796488303009858055/,22日韩国新增确诊病例123例 日本新增确诊病例26例,光明网,0,2020-02-23 12:05:46
https://www.toutiao.com/group/6796450292700283399/,日本新增新冠肺炎确诊病例26例 累计769例,新京报,1,2020-02-23 09:38:16
https://www.toutiao.com/group/6796478839837950476/,日本累计确诊新冠肺炎病例达到769例,二三里资讯济南,0,2020-02-23 11:29:02
https://www.toutiao.com/group/6796454902315876871/,日本新增新冠肺炎确诊病例26例 累计确诊769例,青岛新闻网文旅,0,2020-02-23 09:56:09
https://www.toutiao.com/group/6796487087911600648/,曾进入邮轮的日本官员没检测就去上班，理由竟是…,观察者网新媒体,0,2020-02-23 12:01:03
https://www.toutiao.com/group/6796451789391528455/,日本新确诊26例新冠肺炎 累计确诊769例,中国经济网,2,2020-02-23 09:44:04
https://www.toutiao.com/group/6796514091222434312/,日本探讨使用抗流感药物治疗新冠肺炎,光明网,0,2020-02-23 13:45:50
https://www.toutiao.com/group/6796481152916914701/,日本探讨使用抗流感药物治疗新冠肺炎,新华社客户端,0,2020-02-23 11:38:01
https://www.toutiao.com/group/6796451268341531144/,日本新确诊26例新冠肺炎 累计确诊769例,看看新闻,1,2020-02-23 09:42:03
