no,comments
413,好穿，舒服。
414,物流很快，宝贝很好，店家人nice！好评！
415,不错的选择。
416,还挺不错
417,质量很好，非常满意。
418,物流很快，裤子版型做工都很好
419,质量很好，
420,质量不错，物流给力，值得购买，很满意
421,今天刚收到货试穿了一下结果就成这样了，一百多块钱就买了这么一条裤子，现在又不能退货，只能认倒霉了。失败的一次购物。
422,为什么自动收货了？
423,质量不错
424,不错，喜欢
425,质量不错，满意
426,物流快，质量好，下次还来！
427,非常满意
428,质量很好，服务态度好，物流很快
429,物流快，质量好，版型很好
430,质量不错
431,这个店客服是大爷问句话半天不回，回了也答非所问，售前售后服务极其恶劣，而且尺码一点都不标准！！！！假的很！！！！！
432,材质特性：根本就跟图片上的天然之别，
433,首先恭喜你们获得了我网购历史以来的第一个差评，实在是让我失望透了，下单两件上衣，两件裤子。给我发的货是一件裤子，三件上衣。客服智障的屎一样，问东答西，一直忽悠。本来就是你们发错货了，一点跟进和歉意都没有，我不找你们，你们一定不会主动找我，说让我退回发错的上衣，让仓库拆包确认了再给我发货，一直拖，一直忽悠，差不多半个月了，毛线都没有一个。不是只有你们的时间才值钱，什么都考虑你们，错的你们好吗？一星评价都给多了，总体感觉你们就是一大坨**，草**币。
434,首先恭喜你们获得了我网购历史以来的第一个差评，实在是让我失望透了，下单两件上衣，两件裤子。给我发的货是一件裤子，三件上衣。客服智障的屎一样，问东答西，一直忽悠。本来就是你们发错货了，一点跟进和歉意都没有，我不找你们，你们一定不会主动找我，说让我退回发错的上衣，让仓库拆包确认了再给我发货，一直拖，一直忽悠，差不多半个月了，毛线都没有一个。不是只有你们的时间才值钱，什么都考虑你们，错的你们好吗？一星评价都给多了，总体感觉你们就是一大坨**，草**币。
435,版型还行，但是布料和质量真的很一般，五六十的质量！！
436,裤子，裤子不算长，也懒得退换，很一般，和几十得一个样看着
437,懒得拍照了，质量还行，不过跟图片上的有色差，一般般吧
438,面料和版型都挺好，就是第一次洗有点脱色
439,样式好看，穿着舒服尺码标准。
440,裤子不错。很帅气。做工可以，布料是纯棉的。
441,还行吧，稍微有点偏小
442,我的要求不高，衣服不起球，不掉色，就是好衣服，
443,裤子掉色
444,物流确实不咋样，慢，裤子穿过再来评价
445,料子不错，
446,颜色差异太大
447,买小了又换大号，卖家服务态度好，遗憾物流有些慢
448,货还没看，但就冲着这个服务态度和物流速度，差评给定了
449,不错，挺好看的。
450,发货很快，质量不错，
451,尺码合适，质量可以。
452,质量非常好挺满意的。买给男朋友的，穿着很合适
453,一如既往的好，有需要一定再次回购👍🏻👍🏻👍🏻
454,质量很好，物流很快，好评
455,穿着舒服，价格实惠
456,裤子质量挺不错的，面料很舒服柔软，卖家推荐的尺码很合适
457,款式休闲大方时尚质量保证价格实惠，穿着舒服上档次值得购买。
458,质量很好！！
459,上身效果：很好看 厚薄度：适中 尺码推荐：合适 材质特性：棉
460,质地柔软，非常舒适！洗了下也没褪色，非常不错😊值得推荐，下次还来
461,裤子布料不错，穿着合身暖和，款式可以
462,此用户没有填写评论!
463,尺码合适，质量薄厚适中，不错
464,好评好评配合好评
465,面料柔软款式休闲大方时尚质量保证价格实惠，穿着舒服上档次值得购买。
466,质量还不错，挺好的。
467,裤子质量挺不错的，面料很舒服柔软，卖家推荐的尺码很合适
468,裤子质量挺好的。
469,裤子收到了，穿了一段时间，质量不错，
470,好评😊，不错。
471,不是很厚但也不薄，物流也很给力快，有小时候运动裤的感觉，溜达散步放小件物品正合适，不过不影响美观。就喜欢这样的裤子，洗了一下也没有变形掉色起球，穿上也很合适，摸起来质感超级棒。搭配衣服也很简单帅气~~值得购买，特划算的
472,裤子收到了，穿着大小合适，质量不错，价格便宜，比在实体店买还要便宜，卖家服务态度很好，物流也很快，值得购买。
473,宽松舒服
474,裤子质量很好，版型也好看，挺白搭的，做工很精细。很满意
475,裤子质量很好，到货速度快，穿上很合适
476,到货了，物流很快，卖家服务态度非常好，这个价钱超级合适，下次需要还会来。
477,裤子质量可以  材料很好  穿上整个人都精神了许多
478,质量很不错，穿着很舒服，卖家服务态度也很好，很满意的一次网购
479,比实体店里便宜很多，真是太方便了，价格和质量都不错呢
480,宝贝收到了，质量特别好。穿上超级显瘦。简直是爱了。
481,裤子收到了，尺码很合适，穿着很显瘦，休闲款式的很喜欢
482,上身效果特别好，很满意，颜色也很正。
483,不错不错不错不错
484,裆有点低，其他都还好
485,收到了，物流快，价格实惠，跟描述一致，性价比高，满意
486,赞赞赞，非常满意，穿上超级帅。质量特别好。爱了。
487,宝贝收到了&nbsp;质量很好&nbsp;物流很快&nbsp;性价比很高&nbsp;宝贝与图片相符&nbsp;店主服务态度好&nbsp;很喜欢下次还会来买的！
488,好评，发货速度很快，质量非常好，穿着很合适，满意
489,此用户没有填写评论!
490,此用户没有填写评论!
491,质量没得说，跟专卖店一样，特别特别喜欢，而且价格优惠
492,穿上挺舒服的，都有点舍不得脱下来了！有点弹力穿着上班不会觉着勒！质量也不错，软软的纯棉面料，做工精致！性比价高， 值得推荐！
493,裤子到货了，质量很好，穿着比较舒服，不掉色，推荐购买
