no,comments
0,宝贝已收到物流很快跟描述没有区别！
1,此用户没有填写评论!
2,上身效果：显瘦显高 厚薄度：厚实 整体评价：质量好 面料品质：摸着舒服
3,上身效果：很帅气 厚薄度：现在穿挺合适的 整体评价：很满意
4,老公特别看上这条裤子，面料好，不掉色，花花公子的是正品。
5,裤子的质量非常好。老公很喜欢穿上去很舒服，
6,版型不错，尺码很合适，穿起来也很舒服，有需要还会再来
7,收到，已经穿过一段时间了。质量真心的好。上身又帅气，很满意。
8,裤子质量特别好，厚薄适度，尺码合适，上身效果特别好，穿上很舒服很有气质
9,上身效果很好，穿上大小正合适，很满意。
10,裤子质量很好，穿上很舒服很帅气。
11,裤子版型好看，面料做工精致，穿上很合身很显瘦哦，价格也比实体店便宜多了。
12,上身效果很不错，料子和版型都满意，谢谢！
13,上身效果很好穿着很舒服，尺码标准，款式好看，很满意好评
14,宝贝质量挺好的，款式简单时尚，尺寸标准，大小倒是挺合适的。
15,不错，军绿色的很好看，休闲，很好配鞋，满意
16,质量不错，下水洗了不缩水，不掉色
17,穿了几天才来评价，这裤子真的不错品质很好穿在上身很舒服布料水洗也不会掉色尺寸也刚刚好没误差，整体感觉很不错。
18,效果非常好，朋友说穿起来非常帅气，准备再买一条别的颜色
19,穿起来很合身，很好看很满意。
20,质量不错呢，真的很喜欢，完全超出期望值
21,质量不错做工很好，穿着合身好看
22,裤子质量超级好
23,裤子质量好，颜色正，尺码准，穿着百搭！
24,裤子版型不错，面料也挺厚实，喜欢这个颜色，下次还来你家
25,裤子质量不错，穿着舒服好看。
26,布料优质，款式好看。
27,穿着舒适，显瘦，回南天，买多几条裤子备用！
28,颜色挺好看的 长度刚刚好，质量不错 满意
29,裤子收到了，穿着很舒服，款式很好看，下次还会再来买。
30,质量不错，版型挺正的。
31,收到了，版型很好，质量也好，满意
32,质量特别好
33,东西收到了，质量不错，款式也好看，面料穿着也非常舒服！物流也很给力
34,质量很好哦
35,裤型很好，面料也很赞，这个价格真是超值了，下次再买你家其他款试试，客服服务也很好！
36,裤子不错，挺合身
37,裤子质量不错，面料很好，做工好
38,穿上很合适，面料好做工细致，五星好评
39,工装裤面料很好，上身效果非常好。
40,买小了送给别人穿了，面料挺好纯棉的。
41,上身效果：刚好 厚薄度：刚好 尺码推荐：刚好 整体评价：满意 材质特性：满意 面料品质：满意
42,挺好的，喜欢！尺码合适！
43,裤子质量好，版型正，穿着舒服
44,潮流时尚，喜欢。
45,快递给力 性价比很高 尺码标准 不错的一次购物
46,质量很好的，穿着合身
47,上身效果不错，尺码正好。
48,质地很结实且穿着舒适暖和，颜色也不错又不褪色
49,上身效果：好 厚薄度：很舒适 尺码推荐：准确 整体评价：非常完美 材质特性：有弹力
50,裤子质量不错很满意
51,质量不错呀，还会继续关注哦！
52,裤子版型好看很大方，好评
53,很好，非常好
54,面料舒适版型好，很喜欢。
55,宝贝收到了，质量很好，下次还来！
56,上身效果很好，质量很好，值得购买
57,h很不错 老公很喜
58,质量挺好
59,大小合适 质量很好 穿上时尚又舒适 是我喜欢的款
60,裤子质量非常好，做工完美，值得拥有
61,质量很好，裤子很舒适。大小正合适。尺码标准颜色无色差。
62,质量不错。
63,裤子质量挺好，款式也好看，穿着宽松舒适，满意！
64,挺好的裤子哦！面料不错穿着挺舒服的
65,布料摸着舒服，客户推荐的尺码也很合身，喜欢的赶紧下手
66,裤子做工精细，时尚帅气，穿着舒服，挺好的。
67,质量很好
68,质量很好
69,很好，挺喜欢的
70,质量很好，很喜欢
71,裤子已经收到了，质量很好，穿着合身。
72,面料很舒服，上身效果很好，特别喜欢！
73,款型很好看，穿起来很舒服，下次还会买
74,裤子款式不错，反正孩子喜欢就是好的
75,裤子的版型设计好看，尺码穿着刚刚好，面料柔软不掉色。是正品。
76,好看很满意，很感谢快递在这种情况下还能送来。
77,质量好，款式时尚，码数标准，非常满意
78,质量很好，上身帅气  很棒  满意
79,尺码：2XL。做工：穿了几天，裤子上的纽扣掉下来，一看像是在装扣子的时候用榔头敲的一样变形了，想重新装上去都不行，现在扣子不对称了心里不舒服，其他的没什么问题。弹性效果：-。透明度：-。面料舒适度：-。
80,顺风快递就是快，赞。 裤子质量很好值得购买
81,穿着合身
82,东西已经，收到，很不错，很喜欢，会来追评的
83,上身效果：裤型不错 厚薄度：适中 尺码推荐：身高183合适 整体评价：款式好看质量还行推荐购买
84,版型非常好看
85,质量挺好的
86,质量很好，服务态度很棒，一次愉快的购物。
87,裤子爱了爱了
88,挺好挺不错的
89,收到了 不错
90,非常舒服
91,质量不错，物流速度快，客服态度很好。
92,大小合适 款式时尚 穿上效果挺好的 喜欢
93,上身效果很好，版型帅气、穿着舒适并且很百搭。修身显瘦大家可以放心购买
94,工装裤质量很好，面料柔软舒适有质感，款式时尚潮流，值得购买。
95,裤子质量不错，开始拍小了，最后又拍大了一码，客服服务态度很好，收到宝贝后退款了，最后收到宝贝后儿子很满意。
96,质量不错
97,质量不错，很好
98,款式特喜欢，面料和做工都挺满意的，选购尺码也很合适，下次还来店选购！
99,款式年轻时尚，面料穿着也舒服，好评支持下。
100,质量非常好穿着舒服做工精细尺码标准物流快很满意
101,不错，很有型很潮，没有多余的线头，手感非常好，下次还来买
102,裤子质量非常好，做工材质都是上乘的，很满意。
103,尺码合适，质量和版型都很好，兜多很方便
104,裤子收到了，质量挺不错的。我挺喜欢的，下次还会光顾本店的！
105,裤子质量不错。厚薄正合适。物流给力，非常满意。
106,裤子到货了，质量特别好，面料很舒服
107,裤子面料很舒服，款式好看，做工精细非常满意！
108,裤子质量很好，版型设计的非常不错。
109,裤脚魔术贴质量太差，穿两次就没有粘了，受贴一面全部起毛了不能粘贴了。
110,裤子面料很好，儿子穿上很合身，非常喜欢，好评
111,裤子版型很好很喜欢满意质量也很好
112,裤子质量好，做工也不错，尺码合适，满意。
113,裤子质量挺好的，尺码合适
114,上身效果非常好，穿上很舒服
115,弹性太小，穿不了
116,裤子没有异味，不粘毛不起球，实物与图片一样，洗了ー下，不缩水，不退色，尺码大小正好，纯棉质量穿着体闲大方特别舒服，版型好看上身效果很不错，尺码大小都刚。
117,版型窄，找的模特都是腿特别细的吧？加绒的不厚就算了，外边看上去给人的感觉还是特别厚的那种，穿上才知道是真的不厚&hellip;看了好久的裤子，收到试了一下真的让人伤心了，过年准备穿的，也正好不需要穿了&hellip;&hellip;总而言之就是不开心的一次购物
118,版型很好 过完年还可以穿一阵子 很满意
119,选的尺码标准，穿上刚刚好，面料柔软舒适亲肤，不起球，版型剪裁特别好，上身很修身显瘦！
120,裤子帅气，款式很好，做工也不错，
121,质量不错值得购买！很暖和，很时尚也很显瘦！值得购买
122,质量很好，穿起来很舒服，物美价廉！
123,衣服很不错，质量好，穿着舒服，值得购买
124,质量非常棒，可以，赞美
125,上身效果不错，很帅，很有型
126,质量不错，穿着舒服。
127,挺合身的，而且码数合适
128,衣服质量超出预期，性价比高，满意！
129,裤子非常好看特别喜欢哦
130,年前送到了，真好。快递服务也挺好
131,质量上乘 ，外观精美，服务态度很好，再接再厉哦。
132,上身效果：好看，好酷，显瘦显高 厚薄度：厚实，暖和 面料品质：质量很好，穿着舒服
133,真心不错，会继续支持这家店的！
134,质量很好很不错，非常喜欢
135,春节期间按时发货给个赞，质量很好，没色差
136,质量好，上身帅气
137,裤子面料皮实，码数合适，孩子很喜欢，已经洗过穿了几天了。版型好看，喜欢的朋友推荐购买。
138,不错不错，非常划算。
139,软软的纯棉料子 穿着宽松舒服  做工好细致的  老公说上班穿蹲下去都不怕裤裤破了
140,还不错吧
141,质量挺好的，很满意。
142,收到货就穿了很合适，
143,质量很好，值得购买
144,宝贝收到，很好
145,很不错，挺满意的
146,质量很好，物流很快。
147,不错的选择
148,裤子收到了，面料很好穿着舒适透气，很划算
149,裤子收到了，看上去就蛮好的，线头基本没有，做工也蛮好的，我个人也很满意！版型穿着也比较到位！
150,还可以
151,裤子版型好看，时尚百搭，穿上舒适合身，美观耐看，宝贝帅帅哒。
152,此用户没有填写评论!
153,裤子质量不错，版型好看。穿上码数标准
154,裤子质量好，穿起来很舒服，也得劲，价格也实惠
155,裤子收到了，质量很好，不会起球掉色，穿着舒适
156,面料厚实耐磨，款式时尚，满意
157,版型时尚大方，弟弟穿上合适觉得满意，大小怪美气的，做工特别好
158,值得购买，感觉还可以，洗过了也没有褪色的现象，根据客服推荐的尺码买的很合适，整体来说还可以
159,裤子质量好，穿起来很舒服，做工仔细，价格实惠
160,码数标准，做工细致，上身效果很好，价格实惠。
161,裤子的质量很好，用的面料材质好，穿着很合身，也很舒服，这个款式也很漂亮，很喜欢。
162,这款质量面料不错，穿着舒适合身，款式颜色喜欢
163,发货物流都挺快啊，春节期间完全不受影响！挺不错👍尺码很标准，正合身，不错，质感出色，下次还来
164,宝贝今天拿到了，质量可以，款式不错，值得拥有
165,裤子质量不错，料子摸起来很舒服，版型新颖，是我喜欢的类型。
166,这款裤子试穿过，很显气质，做工及选料都很好，针脚细密款式新颖，孩子很喜欢
167,裤子款式时尚，穿上很好看，面料柔软舒适，质量也很好
168,裤子看着质量不错，款式好看，穿着休闲舒适，满意！
169,裤子挺好，颜色也很好看，搭配衣服挺好搭配的，显瘦舒服，暖和，里面可以加裤子，大小合适
170,码数标准，上身效果很好，价格实惠。
171,裤子质量挺不错的，面料很舒服，做工仔细没有线头没有异味
172,宝贝收到了，我超喜欢做工质地都好的没话说，还有小礼物。呵呵服务态度也超好很有心的店家以后常光顾，下次介绍朋友来真的物超所值
173,出乎意料的很好，裤子面料很好，舒服，穿起来效果不错，准备留着过年穿
174,弟弟太喜欢这条裤子了，大小合适，很是满意
175,裤子质量很好，帮老公买的，他比较喜欢这种风格。
176,裤子收到了，版型好看，面料舒服很百搭
177,裤子试穿过，尺码标准，选料及做工都都挺好的，颜色均匀，没有色差，
178,裤子不错，很潮，时尚，而且面料价格都适中白搭。是我想要的
179,穿上正好，尺码正确，质料不错，做了质量不错。好评
180,裤子质量很好，穿着比较舒服，不掉色，还会回购
181,面料好，束脚的感觉脚长了不少。儿子穿上酷酷的
182,宝贝收到啦 质量很好 款式不错 黑色永远都是那么百搭 喜欢_
183,宝贝已收到，非常满意，质优价廉，保暖抗寒，赞。
184,裤子版型设计的很666 穿着舒适配上我的鞋子，我的颜值瞬间提升
185,不错的裤子，很合身，还挺显瘦的，穿了几天，质量是没有问题的，穿在身上很合身。布料试着还挺透气，很满意的，这种裤子版型很百搭，价格比外面实体的优惠很多，但是款式不比实体的那种差，很满意质量不错，服务态度非常好
186,面料舒适度：不错的裤子，很合身，还挺显瘦的，穿了几天，质量是没有问题的，穿在身上很合身。布料试着还挺透气，很满意的，这种裤子版型很百搭，价格比外面实体的优惠很多，但是款式不比实体的那种差，很满意质量不错，服务态度非常好。
187,大小合适，穿着舒服，款式是我喜欢的，很棒
188,裤子质量很好，很不错穿起来挺舒服  帅气
189,裤子很好，穿上不显胖，很喜欢
190,给老公买的，老公很喜欢，布料柔软舒服！今年流行的款式
191,今年很流行束脚裤啊，我也来跟把风，果然很好穿，裤子质量也不错，满意。
192,裤子版型很好，质量也不错，颜色很喜欢
193,版型很正哦，穿着好看，百搭的裤子，很喜欢
194,给老公买的，码数标准，整体都不错。
195,裤子质量不错，穿着舒服，好搭配。
196,上身效果很好，尺码很合适，朋友看了都说好
197,裤子，男朋友很喜欢这款质量很好呢，发货速度非常快，包装非常仔细、严实
198,收到，质量不错，款式设计新奇
199,裤子收到了，穿上挺舒服，下次还会再来购买
200,裤子很时尚，面料舒服颜色也是我想要的，客服推荐尺码正合适，不错
201,材质特性：质量很不错 性价比很高 很Ma
202,版型好看时尚潮流 面料舒适
203,上身效果：超级好看 厚薄度：中等
204,买来送给老公，上身大小刚好，像小伙子哈哈
205,质量不错，穿着很保暖，上身很有质感
206,不错，款式很潮有型，没有多余的线头
207,终于放假了，正好赶上穿新衣服，裤子版型挺正的，物流也很给力
208,质量挺不错的，款式洋气很满意。
209,我只能说超级好！过年期间快递不易，老板发的顺丰！接到电话我都蒙了，咦，这会儿还有快递？本来就是回购，啥也不说了，好评奉上。
210,裤子柔软穿着特舒服，款式特别流行
211,整体上很满意的一次购物，价格也很实惠爱了爱了
212,裤子质量挺好的，颜色也很正，合身
213,有型，好看，质量也不错
214,裤子质量不错，尺码挺合适的
215,质量挺好，做工精细，穿上挺舒服
216,款式上身效果非常好，卡奇色的很百搭。
217,裤子收到了，质量不错，大小合适，非常满意。
218,裤型好，材质也不错，穿着舒服
219,很不错，刚刚好合身，自我感觉买短了，裤子是很不错的
220,上身效果不错，便宜，质量好。
221,裤子质量很好，做工精细，面料柔软舒适，物流也很快。
222,挺好的，到了好几天了，穿过了，质量挺好的，好看，有型。
223,码数标准穿着挺舒服的。
224,裤子收到了，质量很好，穿着很舒适
225,质量很好的工装裤，版型很好
226,质量可以，和描绪一样
227,穿上合适，也好
228,尺码合适，穿着舒服！
229,喜欢这个版型，穿上很舒服！
230,挺好的，质量不错哦，做工精细，建议购买
231,裤子不错呀，质量没得说
232,裤子质量很好，特别喜欢
233,上身效果：好看。
234,颜色不错 尺码和平时穿的差不多 挺合身
235,感谢疫情这么严重，还能如实发货
236,质量好，穿着舒服，面料柔软
237,裤子收到了质量特别好
238,好看，下次还来这家店
239,谁买谁后悔，粘毛特别严重，你们看着办吧，我只能帮到这了，算我买了个教训吧，***😡
240,好好好，好看又舒服暖和，完美
241,穿起来很舒服，质量也很好。
242,衣服料子很好，
243,这款工装裤子真好看，很合身哟
244,孩子还没有穿哦，穿过以后才评价
245,垃圾垃圾，做工垃圾，残次品
246,裤子挺好的，做工可以，发货很快，价格也优惠
247,质量不错，版型好看
248,裤子面料很好，尺码标准
249,上身效果特别好！帅呆了！
250,炒鸡好看，又好穿，舒服，不错
251,裤子收到了，穿着挺漂亮，物流很给力，好评！
252,裤子做工很好
253,很合身，面料不错
254,做工精细，和描述一样的好，质量好
255,还不错挺喜欢很满意的一次购物
256,上身效果：太好了
257,宝贝收到了，质量不错，非常的满意。
258,裤型很好，穿上很酷！不错！
259,宝贝物超所值，很喜欢，下次还会来的
260,发货挺快的  质量很不错  挺满意的  卖家服务态度好
261,质量特别好
262,还不错挺喜欢的裤子
263,很满意，很舒服，大气，给老公买的
264,宝贝已收到，质量好，面料舒服，值得推荐。
265,东西不错，发货够快！666棒棒哒
266,裤子质量挺好的，物美价廉哦
267,质量很好，服务态度很棒，一次愉快的购物。
268,质量很好。面料很舒服。满意
269,新年衣服  不错
270,衣服很不错，质量很好
271,很好！穿着舒服。
272,收到了，不错，穿着很舒服，
273,一直相信花花公子的牌子
274,L码显大啊，165的个子
275,大小合适，很不错
276,挺好看的很合身
277,非常满意赞赞赞
278,满意质量好
279,完美，没毛病
280,不错 满意
281,不错，裤子不错，质量不错，快递也很快
282,裤子是没有弹力的，所以如果里面套一件秋裤的话，请买大一号的，要不运动不方便，蹲下去和做大动作时都不方便
283,不错，以后追加。
284,很好，还会再来的
285,质量不错
286,质量好，喜欢
287,质量不错
288,非常喜欢，
289,质量挺好的，很满意
290,裤子版型帅气穿着舒适并且很百搭，上身效果很好很潮！做工精细看着很有质感。推荐购买
291,很潮流，上身效果超级好，太帅了，搭配点休闲衣服鞋子，真的是非常肥肠好看，质量满意款式满意
292,质量不错值得购买！厚实漂亮！穿上很显身材
293,裤子穿上舒服尺码标准价格合理质量很好做工精细推荐购买
294,裤子收到了，颜色很正，包装很精致，穿上很合身，摸着很舒服性价比很高
295,裤子收到了，质量非常好，穿在身上也很合适，面积穿着也很舒服，款式简单好看。
296,裤子质量挺好的，厚度正好，穿上有型，满意
297,裤子版型好看，大小很合适，质量满意
298,给弟弟买的，他挺喜欢的，还穿去相亲了，成功了，现在天天出去浪都穿着，还要我再下手件，看来很值得拥有！
299,收到就试穿了一下，尺码标准用料也挺好的，穿着很舒服挺满意的
300,裤子质量挺好的，面料也舒服，现在都比较喜欢穿工装裤，总体还是挺满意的
301,裤子收到了，上身效果特别好，休闲还有型。裤子的面料的手感特别好。好评
302,裤子回来了没让我失望，做工质量都不错，包装也挺严实
303,布料质量都很好，这是第二条了。而且物流也很快服务也很好，下着大雪依然坚持送件！！！
304,太差了，掉色太严重了，一点也不好，一点都不值这个价钱
305,裤子的版型很好，款式很潮，穿着舒服，保暖性也不错。
306,裤子质量很好，摸着很舒服，穿着也很舒服，尺码也刚刚好。
307,裤子穿着舒适，面料柔软，做工精细，质量很好。
308,裤子质量挺好的，版型也挺好看的，穿上特别的显瘦，特别的舒服，真的挺值的，满意
309,这款裤子真的挺好，就是颜色有点不满意，不知道我儿子喜不喜欢，还没试试完再给好评。
310,尺码标准，面料非常舒服，穿着好看。
311,特别喜欢，穿着合适，舒服，以后衣服就他加了，
312,质量挺好的和卖家描述的一样有需要还会来的
313,质量很好，款式也不错，穿起来很休闲，很舒服
314,今年特别流行这样的裤子，于是我给老公也买了一条。一收到货就给老公试了一下，没想到还挺适合他的
315,这衣服质量很棒，穿上非常舒服。料柔软舒适。
316,面料不错，大小合适，穿着舒服
317,裤子质量非常好，百搭款穿什么都很酷
318,裤子和描述的一样，质量很不错，尺码也很合适。
319,今年男女都流行浅色的，买个浅裤子配女票情侣
320,很时尚百搭的裤子，选的尺码正合身，做工也不错
321,好看的裤子，面料很好版型穿着好看，喜欢
322,裤子己经穿上了，挺合适的，穿着也舒服，老公很喜欢
323,裤子穿着很舒服合适，面料也舒服，满意
324,修身款的，穿着合适，做工还可以，满意
325,裤子不错，大小也合适，穿着很舒服，满意
326,合适好看，质量好。百里挑一，物美价廉超划算。
327,裤子质量很好做工精细化颜色款式好看！
328,冬天穿太薄了，质量一般般吧
329,商品便宜实惠 快递也迅速
330,质量很好，款式好看。颜色无色差，大小合适
331,质量很好，穿上去很舒服，面料很舒服满意
332,形体不错 款式时尚 面料柔软 满意
333,好评，大小正好，料也不会有很多折子。也很有型
334,上身效果好，质量不错，穿几天效果好再买一条换洗吧
335,裤子这款质量很好呢，发货速度非常快，包装非常仔细、严实
336,质量跟图片是有差距的.也有些许的线条没剪掉.快递挺快的
337,好东西值得分享给大家，蛮满意。喜欢的可以放心购买。
338,给弟弟买的，穿上版型超正，做工精细物流很快
339,质量不错，穿着很舒服， 款式潮流
340,裤子收到了，我挺满意的，挺不错的，下次还会光顾本店的！
341,面料很舒服，版型正，超级稀罕！
342,裤子质量很好，做工精细，非常好。
343,喜欢穿工装裤，休闲好看
344,面料挺好的，码数刚好合适
345,裤子不错，挺好的，很个性，喜欢
346,尺码标准，做工精细，穿着舒服？
347,裤子质量不错，款式时尚显年轻，大小合适穿着也舒服，还挺帅气的
348,裤子质量好，面料和做工不错，满意
349,裤子质量很好，款式好看  帅气
350,款式很大方，质量非常好，价钱也很合理！
351,裤子很潮哦，穿起来很帅气
352,很不错，穿起来很舒服，也没有色差
353,布料不错，很喜欢的产品，给个好评
354,尺码标准，大小合适，穿着很舒服
355,上身效果很好，非常有型，性价比高，值得推荐。
356,老公穿着刚好合适
357,质量很好，手感也很不错，而且价格也很优惠！值得购买！
358,好看，合适
359,版型不错 质量蛮好的 好评
360,质量挺好的这次购物很满意
361,质量很好，穿着很舒服，很暖和
362,上身效果很好，尺码也很标准，好评
363,好评，非常满意，版形好，尺码准确！
364,质量很好，穿起来很舒服，物美价廉！
365,质量不错呀，还会继续关注哦！
366,裤子很好看，质量很好，价格也便宜
367,宝贝非常好，价格便宜质量好!
368,裤子版型很好！质量不错😊做工很精细。卖家服务态度好。满意
369,穿着有型，帅！
370,裤子挺不错的，质量可以，满意
371,穿了下很合身，是我想要的样子
372,质量不错，大小合适！
373,裤子面料很好，款式很潮，穿上舒适好看，满意
374,裤子面料很好，做工仔细，版型超喜欢，上身很舒服
375,酷似做工很好穿着很舒服
376,裤子还是不错的，就是有点贵
377,质量很好下次再来
378,穿起来挺舒服的，质量不错
379,裤子收到可以，手感不错
380,尺码标准，质量很好，做工细致，非常满意
381,第一次尝试工装裤，酷酷的感觉，，很喜欢😃
382,质量不错很喜欢哦
383,穿着很舒服，质量不错
384,上身效果非常好
385,上身效果非常好。
386,裤子非常好看特别喜欢哦哦
387,穿着舒服
388,质量好，上身效果棒棒哒，做工精致，满意
389,面料很好 好评
390,看中这质量
391,裤子很合身，穿着舒服，质量不错哦
392,裤子质量很好，不缩水，穿着很舒服
393,客服回的慢点。但是很周到 邮政慢说了一下就给发顺丰了。特别好
394,赞，怎么说呢，东西好，快递速度快，收到挺开心的
395,非常好，下次还会再回购
396,裤子还是不错的，品牌的就是好，满意。
397,不错哦，质量很好哦，赞一个
398,做工不错
399,很不错，比预想的还好呢。价格也公道，谢谢啦~~~
400,裤子不错  好吧
401,收到货了，和想象的样子一样，质量好
402,质量不错，很洋气。
403,好看呀。喜欢。
404,质量不错，物流很给力，穿着很合身
405,很好，买给我老公的，很酷
406,收到啦 不错非常好
407,挺不错的，舒适合身
408,布料挺好的，满意
409,质量很好，做工精细，物流发货快
410,裤质量好，合身
411,上身效果：物流好慢啊
412,版型很好！物流很快！质量不错！
